{
  "model_config": {
    "context_length": 4096,
    "search": {
      "method": "greedy",
      "temperature": 0.6,
      "top_k": 1,
      "top_p": 0.9,
      "stop_on_eos": true,
      "max_length": 256
    }
  },
  "prompts": [
    {
      "system": "You are an AI assistant. User will you give you a task. Your goal is to complete the task as faithfully as you can. While performing the task think step-by-step and justify your steps.",
      "user": "Two neighboring farms both had depleted soils due to intensive agricultural practices for decades. Apple far decided to start an agroforestry system and other methods to protect their depleted soils, while Pear farm did nothing and had big losses the following years.  Which farm used fewer cover crops?"
    }
  ],
  "category": "Content Generation",
  "apply_chat_template": true
}
